<?xml version="1.0" encoding="UTF-8"?>
<!-- edited with XMLSPY v5 rel. 4 U (http://www.xmlspy.com) by Son H. Kim (PNNL) -->
<!--XML file generated by XMLSPY v5 rel. 2 U (http://www.xmlspy.com)-->
<scenario xmlns:xsi="http://www.w3.org/2001/XMLSchema-instance" xsi:noNamespaceSchemaLocation="C:\PNNL\CIAM\CVS\CIAM\Ciam.xsd" name="Reference" date="2003-7-8T15:35:46-00:00">
	<summary>"SRES B2 Scenario is used for this Reference Scenario"</summary>
	<modeltime>
		<startyear>1975</startyear>
		<interyear1>2005</interyear1>
		<interyear2>2020</interyear2>
		<endyear>2095</endyear>
		<startReportYear>1990</startReportYear>
		<timestep1>15</timestep1>
		<timestep2>15</timestep2>
		<timestep3>15</timestep3>
		<popbegin>1960</popbegin>
		<dataend>2095</dataend>
		<datatimestep>15</datatimestep>
	</modeltime>
	<world>
	</world>
</scenario>